id,title,description,price,beds,baths,sqft,address,url
1,Charming bungalow,"Cozy 3 bed bungalow near downtown. Original hardwood, large yard.",350000,3,2,1250,"123 Maple St, Springfield, IL",""
2,Modern condo,"2 bed condo, renovated kitchen, building with gym. Walk to transit.",280000,2,1,900,"456 Oak Ave, Chicago, IL",""
3,Investment duplex,"Two-unit duplex, both units rented. Strong cashflow.",420000,4,3,2200,"789 Pine Rd, Columbus, OH",""
4,Suburban family home,"4 bed, 3 bath, finished basement, good school district.",525000,4,3,3000,"101 Elm St, Naperville, IL",""
5,Fixer-upper,"Handyman special — needs full renovation. Large lot.",150000,2,1,1100,"202 Birch Ln, Dayton, OH",""
6,Lakefront cottage,"Small cottage with private lake access. Seasonal rental potential.",390000,2,1,800,"303 Shore Dr, Lakeville, MN",""
